{
  "schema_version": "0.1",
  "evidence_id": "evidence.gd1.firmware-virtual",
  "target_revision": "r1",
  "status": "valid",
  "envelope": {
    "schema_version": "0.1",
    "tool_name": "acd-firmware-esp32c3",
    "tool_version": "9.2.2 (esp_develop_9.2.2_20260417)",
    "format_version": "0.1",
    "config_hash": "sha256:0d07f74c3775b059239be7e082f105f2f5bba4e9d2503b4169cf14bb19dc8850",
    "input_hash": "sha256:2c4162f242a7e73a6185554237abb2dec6868cb443679eba2ef6bee52292811a",
    "output_hash": "sha256:ad83d16514ac188cde761969c380ea133ed7cff509c55daf8c45cb13ea5cd8cb",
    "execution_env": "linux-x86_64; container=sha256:26ac3a2ee8c7fa3fd8f7e43cba61baefdff72540775d06cc739f1042115251ae",
    "execution_context": "container",
    "container_image_digest": "sha256:26ac3a2ee8c7fa3fd8f7e43cba61baefdff72540775d06cc739f1042115251ae",
    "measurement_conditions": "virtual device (QEMU esp32c3); no SHT40 attached; virtual verification only, not real-device evidence; virtual run stopped by the intended 15s bound (exit code 124); this is the normal completion condition of the bounded virtual run, not a failure",
    "convergence_state": "converged",
    "target_revision": "r1",
    "started_at": "2026-09-06T14:09:14.770782Z",
    "finished_at": "2026-09-06T14:11:10.796692Z",
    "exit_code": 0,
    "idempotency_key": null,
    "uncertainty": null
  },
  "claims": [
    {
      "subject_node": "fw.module.main",
      "property": "measurement_class",
      "value": "virtual",
      "verified": true
    },
    {
      "subject_node": "fw.module.main",
      "property": "real_device_measurement",
      "value": false,
      "verified": true
    },
    {
      "subject_node": "fw.module.main",
      "property": "virtual_target",
      "value": "qemu-esp32c3",
      "verified": true
    },
    {
      "subject_node": "fw.module.main",
      "property": "virtual_run_termination",
      "value": "stopped by the intended 15s bound (exit code 124); this is the normal completion condition of the bounded virtual run, not a failure",
      "verified": true
    },
    {
      "subject_node": "fw.module.main",
      "property": "toolchain_version",
      "value": "esp-idf v6.1",
      "verified": true
    },
    {
      "subject_node": "fw.module.main",
      "property": "firmware_source_hash",
      "value": "sha256:d05faa6f6ada9724f5767b226dde08eae78ef3fa07327fa4ad295220e840e755",
      "verified": true
    },
    {
      "subject_node": "fw.module.main",
      "property": "firmware_artifact_hash",
      "value": "sha256:8ac700609ca4ceaa467e14c81691d086055c95efa6c636520dadf8cc354e7a49",
      "verified": true
    },
    {
      "subject_node": "fw.module.main",
      "property": "firmware_skill_script_sha256",
      "value": "sha256:3fcd29268c0f5eb78d2cbdb2ea16b604b60a221e025aa16fb3f3576dcd425b2e",
      "verified": true
    }
  ],
  "created_at": "2026-09-06T14:11:10.798310Z"
}
