{
  "schema_version": "0.1",
  "evidence_id": "evidence.gd1.electrical",
  "target_revision": "r1",
  "status": "valid",
  "envelope": {
    "schema_version": "0.1",
    "tool_name": "kicad-cli",
    "tool_version": "10.0.6",
    "format_version": "10.0.6",
    "config_hash": "sha256:9627327de367cbe4931cf629888b74dbf6185fab63331091a8b425dce95b2b0c",
    "input_hash": "sha256:ad491f1018c218e0eb90bc72543d111c2808dba218d1e6219565d1fa8a9a799e",
    "output_hash": "sha256:82a2fc6177bdee130f1029d0e0494be97e76ccf2f84543f5f63e903eaa175f9a",
    "execution_env": "linux-x86_64; container=sha256:26ac3a2ee8c7fa3fd8f7e43cba61baefdff72540775d06cc739f1042115251ae",
    "execution_context": "container",
    "container_image_digest": "sha256:26ac3a2ee8c7fa3fd8f7e43cba61baefdff72540775d06cc739f1042115251ae",
    "measurement_conditions": "single run; project-local library tables",
    "convergence_state": "not_applicable",
    "target_revision": "r1",
    "started_at": "2026-09-06T14:12:27.553914Z",
    "finished_at": "2026-09-06T14:12:28.767304Z",
    "exit_code": 5,
    "idempotency_key": null,
    "uncertainty": null
  },
  "claims": [
    {
      "subject_node": "board.gd1",
      "property": "erc_error_count",
      "value": 0,
      "verified": true
    },
    {
      "subject_node": "board.gd1",
      "property": "functional_block_contract",
      "value": "acd-functional-blocks-14.2:sha256:a8b6542cda566a525c249ad37ec3e89e165027af6aea1187856de81a4dfe2abd",
      "verified": true
    },
    {
      "subject_node": "board.gd1",
      "property": "declared_functional_blocks",
      "value": "esp32c3_strapping_boot,firmware_pin_map,i2c_bus_pullup,safety_power_boundary,single_ldo_power_tree,usb_c_cc_termination",
      "verified": true
    },
    {
      "subject_node": "board.gd1",
      "property": "erc_unconnected_count",
      "value": 0,
      "verified": true
    },
    {
      "subject_node": "board.gd1",
      "property": "routing_converged",
      "value": true,
      "verified": true
    },
    {
      "subject_node": "board.gd1",
      "property": "drc_error_count",
      "value": 0,
      "verified": true
    },
    {
      "subject_node": "board.gd1",
      "property": "drc_unconnected_count",
      "value": 0,
      "verified": true
    },
    {
      "subject_node": "board.gd1",
      "property": "silkscreen_status",
      "value": "measured_pass",
      "verified": true
    },
    {
      "subject_node": "board.gd1",
      "property": "dfm_status",
      "value": "pass",
      "verified": true
    },
    {
      "subject_node": "board.gd1",
      "property": "order_readiness_status",
      "value": "ready",
      "verified": true
    },
    {
      "subject_node": "board.gd1",
      "property": "usb_cc",
      "value": "pass",
      "verified": true
    },
    {
      "subject_node": "board.gd1",
      "property": "i2c_pullup",
      "value": "pass",
      "verified": true
    },
    {
      "subject_node": "board.gd1",
      "property": "strapping_pin",
      "value": "pass",
      "verified": true
    },
    {
      "subject_node": "board.gd1",
      "property": "pin_firmware_alignment",
      "value": "pass",
      "verified": true
    },
    {
      "subject_node": "board.gd1",
      "property": "power_decoupling",
      "value": "pass",
      "verified": true
    },
    {
      "subject_node": "board.gd1",
      "property": "power_boundary",
      "value": "pass",
      "verified": true
    }
  ],
  "created_at": "2026-09-06T14:12:46.434384Z"
}
